Title,Channel,Views,Likes,Category ID,Category Name,Timestamp
CORINTHIANS 0 x 1 ARGENTINOS JUNIORS - MELHORES MOMENTOS | CONMEBOL LIBERTADORES 2023,Paramount+ Brasil,409469,7973,24,Entertainment,2023-04-20 12:11:00
VIVI - VINGANCINHA (Clipe Oficial),Vivi,324218,35218,10,Music,2023-04-20 12:11:01
Mari Fernandez - QUANDO TEM SENTIMENTO (DVD Ao Vivo em São Paulo),Mari Fernandez,1681611,20155,10,Music,2023-04-20 12:11:01
INTER SE CLASSIFICA EM JOGO DE 6 GOLS E VAI ENCARAR O MILAN NA SEMI DA CHAMPIONS LEAGUE,TNT Sports Brasil,1331215,57053,17,Sports,2023-04-20 12:11:01
HAALAND HUMILHA UPAMECANO E ACABA COM O BAYERN! BAYERN DE MUNIQUE 1 X 1 MANCHESTER CITY | CHAMPIONS,TNT Sports Brasil,2353985,101715,17,Sports,2023-04-20 12:11:01
RODRYGO FAZ 2 E DESTRÓI O CHELSEA NA CHAMPIONS LEAGUE! CHELSEA 0 X 2 REAL MADRID | MELHORES MOMENTOS,TNT Sports Brasil,2951802,132688,17,Sports,2023-04-20 12:11:01
TRANSFORMEI O PORTAL DO END,Fixz,287195,14474,20,Gaming,2023-04-20 12:11:01
Presidente LULA fala ABSURDOS sobre VÍDEO-GAME e é duramente CRITICADO,Gameplayrj,192970,34699,20,Gaming,2023-04-20 12:11:01
São Paulo 2 x 0 Puerto Cabello - Melhores Momentos | CONMEBOL Sudamericana 2023,SBT Sports,323820,8338,17,Sports,2023-04-20 12:11:01
"PEDRO DESTRÓI, E FLAMENGO VENCE O ÑUBLENSE NA ESTREIA DE SAMPAOLI NA LIBERTADORES",ESPN Brasil,496243,22934,17,Sports,2023-04-20 12:11:01
VELOZES E FURIOSOS 10 | Trailer Oficial 2 (Universal Studios) - HD,Universal Pictures Brasil,51924,4127,24,Entertainment,2023-04-20 12:11:01
BLACKPINK Carpool Karaoke,The Late Late Show with James Corden,7076855,703197,24,Entertainment,2023-04-20 12:11:01
Loco Abreu | Visita Especial,Botafogo TV,42872,7690,17,Sports,2023-04-20 12:11:01
🌍 MODO DOMINAÇÃO com Teste de QI dos Mobs!,Geleia,882156,45266,20,Gaming,2023-04-20 12:11:02
"PISCINA, BANHEIRA OU BALDE EM 24 HORAS! - Desafio",Enaldinho,1019564,37248,20,Gaming,2023-04-20 12:11:02
FUI PEGAR O HAKI DA VISÃO NO BLOX FRUITS E LEVEI UMA SURRA DO PIRATA MAIS FORTE DO ONE PIECE!,Jazzghost,764390,45724,20,Gaming,2023-04-20 12:11:02
FLUMINENSE 1 x 0 THE STRONGEST - MELHORES MOMENTOS | CONMEBOL LIBERTADORES 2023,Paramount+ Brasil,512742,8507,24,Entertainment,2023-04-20 12:11:02
Foo Fighters - Rescued (Lyric Video),Foo Fighters,510806,29517,10,Music,2023-04-20 12:11:02
QUEM SOBREVIVEU AO TORNADO BASE DE OURO OU BASE DE DIAMANTE NO MINECRAFT,Lopers ,539446,18648,22,People & Blogs,2023-04-20 12:11:02
ALUGANDO O PIOR APARTAMENTO DO BRASIL,Felipe Neto,644462,71894,24,Entertainment,2023-04-20 12:11:02
💣BBB23: Boninho compartilha vídeo contra desérticas e causa; Boco Roso e Jojo Todynho são detonados,WebTVBrasileira,170759,18605,24,Entertainment,2023-04-20 12:11:02
DEIXEI A BASE DO MEU AMIGO INVISÍVEL PARA ME VINGAR,MucaHD,240820,13455,20,Gaming,2023-04-20 12:11:02
"VÍTOR ROQUE FAZ PINTURA, ATHLETICO- VENCE E COMPLICA ATLÉTICO-MG NA LIBERTADORES | MELHORES MOMENTOS",ESPN Brasil,984689,38856,17,Sports,2023-04-20 12:11:02
QUANDO A VISITA CHEGA - PLANETA DAS GÊMEAS,Planeta das Gêmeas,130640,4613,24,Entertainment,2023-04-20 12:11:02
CENI CAIU! DEMISSÃO PODE EVITAR O PIOR MAS NÃO RESOLVE OS PROBLEMAS ESTRUTURAIS DO SPFC!,BAROLO VÍDEOS,173954,24181,17,Sports,2023-04-20 12:11:03
"""Teu pai tá aqui! Pede bença!"" | Na Escuta: CBLOL 2023: 1ª Etapa (Grande Final)",CBLOL,108027,10622,20,Gaming,2023-04-20 12:11:03
Canção e Louvor - Espírito Santo (Vídeo Oficial) | Estações,duplacancaoelouvor,156899,10753,10,Music,2023-04-20 12:11:03
FIZ A TORTA ASSIM PARA MINHA MÃE E NÃO PARAM DE ME PEDIR ESSA RECEITA! FÁCIL! RÁPIDA-Isamara Amâncio,Isamara Amâncio,278397,14101,27,Education,2023-04-20 12:11:03
DICAS #2 RODADA | CARTOLA FC 2023 | COMO SEGUIR VALORIZANDO!,BetinGamer,106820,10203,17,Sports,2023-04-20 12:11:03
ABRINDO OS MEUS PRESENTES DE ANIVERSÁRIO!!! 🎁😍,Bia Chagas,51861,7923,23,Comedy,2023-04-20 12:11:03
Jorge Sampaoli comanda primeiro treinamento no Flamengo,FLA TV,398840,37038,17,Sports,2023-04-20 12:11:03
Fernandinho | Jeová (Álbum Único - Live),Fernandinho Ministério Faz Chover,119113,8232,24,Entertainment,2023-04-20 12:11:03
Peguei meu primeiro esturjão no lago San Joaquim Fishing Planet,LeyBritoGamer,47344,1513,20,Gaming,2023-04-20 12:11:03
Mega dumpster encontrei caixas cheias no lixo das lojas,Adeline Camargo,141905,25016,22,People & Blogs,2023-04-20 12:11:03
LBFF 2023 RODADA 03 AO VIVO - GRUPOS B E C | FREE FIRE ESPORTS BRASIL,Free Fire Esports Brasil #LBFF,618229,37130,20,Gaming,2023-04-20 12:11:03
Senador Sergio Moro concede entrevista sobre denúncia da PGR apresentada contra ele,TV Senado,214137,9002,25,News & Politics,2023-04-20 12:11:04
Primeira compra no mercado para o apartamento + limpeza e guardando tudo 🛒🛍️,Mabs,68727,8570,22,People & Blogs,2023-04-20 12:11:04
Gabriel Guedes - Ele Vem (Ao Vivo),Gabriel Guedes,73538,4908,10,Music,2023-04-20 12:11:04
"🔥BBB23: Domitila é eliminada, cactos tombam e % surpreende; Fim do Alface? Bate-boca: Lari X Ricardo",WebTVBrasileira,285289,25669,24,Entertainment,2023-04-20 12:11:04
"QUEM FICAR MAIS TEMPO NO CONCRETO, VENCE!",Enaldinho,1007107,44395,20,Gaming,2023-04-20 12:11:04
VLOG: A LOUD É BICAMPEÃ DO CBLOL!,LOUD League of Legends,80589,12100,24,Entertainment,2023-04-20 12:11:04
O PORÃO DA NOVA ESCOLA TAMBÉM TEM UM SEGREDO OBSCURO! - Kindergarten 2,Jazzghost,810106,49045,20,Gaming,2023-04-20 12:11:04
HAT-TRICK SENSACIONAL DO BENZEMA NA CHAMPIONS! CHELSEA 1 X 3 REAL MADRID | QUARTAS | CHAMPIONS 21/22,Melhor Futebol do Mundo - TNT Sports Brasil,356968,7078,17,Sports,2023-04-20 12:11:04
INVADIRAM MINHA CASA ABANDONADA E PIXARAM A PISCINA!!,Jully Molinna,931382,43113,24,Entertainment,2023-04-20 12:11:04
Estou me Mudando para a Nova Casa | Luluca,Crescendo com Luluca,1132161,71768,22,People & Blogs,2023-04-20 12:11:04
NOSSO MOMENTO DESCOBRINDO A GRAVIDEZ !!!,Casinha da Sabrina,180897,34998,22,People & Blogs,2023-04-20 12:11:04
Apresentação Jorge Sampaoli - AO VIVO,FLA TV,308022,30853,17,Sports,2023-04-20 12:11:05
O Dia que Me Tornei o Homem Mais Rico do Mundo,Problems,708102,23923,20,Gaming,2023-04-20 12:11:05
UM PEIXE ESTRANHO na MINHA JANELA (The Fish's Tale),Tex HS,441040,10550,20,Gaming,2023-04-20 12:11:05
PASTELÃO MAIS SABOROSO DO MUNDO APRENDA FAZER E GANHE DINHEIRO,Weder Silva,266833,11446,22,People & Blogs,2023-04-20 12:11:05
"B. MEZENGA, G. INOCÊNCIO E LUAN DIAS | APRESENTAÇÃO (18/04/23)",Santos Futebol Clube,42886,2887,17,Sports,2023-04-20 12:11:05
Fernandinho | Moisés (Álbum Único - Live),Fernandinho Ministério Faz Chover,155634,10731,24,Entertainment,2023-04-20 12:11:05
Cassiane e Gabriela Rocha - Minha Bênção (Ao Vivo) (Clipe Oficial MK Music),MK MUSIC,248573,16358,10,Music,2023-04-20 12:11:05
o melhor MOD da HUMANIDADE VOLTOU… (desculpa authentic),porkinbr,134779,11774,20,Gaming,2023-04-20 12:11:05
CIVIC HÍBRIDO X NOVO JETTA GLI X BMW 320I! Qual sedã leva a melhor na Volta Rápida?,Acelerados,193324,16949,2,Autos & Vehicles,2023-04-20 12:11:05
DICAS RODADA #2 CARTOLA FC 2023 | VAMOS MITAR +100 PONTOS,Cartola Master,50807,2863,17,Sports,2023-04-20 12:11:05
EU CRIEI A ZONA MAIS PERIGOSA DO MINECRAFT - StonksCraft 2,Apuh,313411,36975,20,Gaming,2023-04-20 12:11:05
"SUMI, PQ FOI TENSO!",Evelyn Regly,219545,24084,26,Howto & Style,2023-04-20 12:11:06
Grupo Frontera x Bad Bunny - un x100to (Video Oficial),Grupo Frontera,25377014,1099964,10,Music,2023-04-20 12:11:06
"Game Recap: Kings 114, Warriors 106",Motion Station,249448,3400,17,Sports,2023-04-20 12:11:06
LOUD x FURIA (Mapa 1: Split) | VCT Americas,VALORANT Esports BR,63068,2108,20,Gaming,2023-04-20 12:11:06
"SALAH BRILHA, JOTA QUEBRA JEJUM DE UM ANO, E LIVERPOOL GOLEIA O LEEDS PELA PREMIER LEAGUE",ESPN Brasil,1085987,45992,17,Sports,2023-04-20 12:11:06
Wellinton Pedro canta 'A Mulher Maravilha' nas Audições às Cegas – The Voice Kids | 8ª Temporada,The Voice Kids Brasil,178095,4179,24,Entertainment,2023-04-20 12:11:06
LBFF 2023 RODADA 02 - GRUPOS A E C | FREE FIRE ESPORTS BRASIL,Free Fire Esports Brasil #LBFF,838429,49679,20,Gaming,2023-04-20 12:11:06
PLANETA DE ÁGUA vs PLANETA DE LAVA do ATHOS,Athos,898247,25199,20,Gaming,2023-04-20 12:11:06
IMPORTANTE COMUNICADO BETÃO | IRONBERG,Ironberg,70959,3714,17,Sports,2023-04-20 12:11:06
"""É MUITO CURIOSA a MUDANÇA DE COMPORTAMENTO do Flamengo, né? E o Sampaoli..."" Mauro Cezar ANALISA!",Jovem Pan Esportes,530571,19176,17,Sports,2023-04-20 12:11:07
Bastidores | Botafogo 2x1 São Paulo | Brasileirão,Botafogo TV,45414,6104,17,Sports,2023-04-20 12:11:07
COMENDO AS COMIDAS MAIS FAMOSAS DO MUNDO TODO POR 24 HORAS!,Enaldinho,851940,32118,20,Gaming,2023-04-20 12:11:07
INAUGURAÇÃO OFICIAL DA ARENA MRV! VEJA COMO FICOU O NOVO ESTÁDIO DO ATLÉTICO MG PRONTO,Yara Fantoni,103045,3338,17,Sports,2023-04-20 12:11:07
Minecraft realista de R$1 e R$1000,Geleia,600798,15868,20,Gaming,2023-04-20 12:11:07
BASTIDORES | ATLÉTICO 1 X 2 VASCO | VASCOTV,VascoTV,180889,22046,17,Sports,2023-04-20 12:11:07
"""O Fagner é um CARA MALDOSO! Gente, ATÉ O CRAQUE NETO falou que..."" COTOVELADA provoca DEBATE!",Jovem Pan Esportes,392793,12850,17,Sports,2023-04-20 12:11:07
NCT DOJAEJUNG 엔시티 도재정 'Perfume' MV,SMTOWN,10371059,363297,10,Music,2023-04-20 12:11:08
O VOO DE TESTE DO STARSHIP - PRIMEIRA TENTATIVA,SpaceToday,163271,12052,24,Entertainment,2023-04-20 12:11:08
O Último Ronin | Michelangelo (The Last Ronin) | Basara,Basara,144502,20304,10,Music,2023-04-20 12:11:08
FLAMENGO 3 X 0 CORITIBA | MELHORES MOMENTOS | 1ª RODADA BRASILEIRÃO 2023 | ge.globo,ge,1425155,57144,17,Sports,2023-04-20 12:11:08
ƻθƻ੩ ȾꝊɄꞦ ꝐɆŁꝊ ᛗɆɄ ꝖɄȺꞦȾ...ꝊꞨȻꞦꝊꝊꞦ,Jazzghost,890914,61382,20,Gaming,2023-04-20 12:11:08
aespa 에스파 'MY WORLD' INTRO,aespa,1139208,135130,10,Music,2023-04-20 12:11:08
ENTREGANDO OS PRESENTES DE ANIVERSÁRIO DO LUCAS 😍,Sunaika Bruna,243761,25244,24,Entertainment,2023-04-20 12:11:08
💥BBB23: Fim de Domitila? Alface indica Amanda e ela pega ar; Lari chora de medo; Sarah é eliminada,WebTVBrasileira,344036,29374,24,Entertainment,2023-04-20 12:11:08
A COMUNIDADE - ENCONTRO NA BARRACA DO BEIJO! 💋,Dinah Moraes,269447,14936,24,Entertainment,2023-04-20 12:11:09
Arthur Brussolo canta 'Coração Bandido' nas Audições às Cegas – The Voice Kids | 8ª Temporada,The Voice Kids Brasil,65932,588,24,Entertainment,2023-04-20 12:11:09
BOLO DE BRIGADEIRO GELADO BEM CHOCOLATUDO - O MELHOR BOLO QUE EU JÁ FIZ - Receitas de Pai,Receitas de Pai,135923,16969,24,Entertainment,2023-04-20 12:11:09
CORINTHIANS 2 X 1 CRUZEIRO | MELHORES MOMENTOS | 1ª RODADA BRASILEIRÃO 2023 | ge.globo,ge,1042402,37072,17,Sports,2023-04-20 12:11:09
Passei a Noite na Casa Mais Solitária do Brasil,Balian,457203,31355,22,People & Blogs,2023-04-20 12:11:09
REFORMEI AS ESTRUTURAS MAIS ANTIGAS DO MINECRAFT,Tonigon,1285574,54224,20,Gaming,2023-04-20 12:11:09
O PODER SUPREMO DOS PETS!!! - STONKSCRAFT,Lggj,206227,21376,20,Gaming,2023-04-20 12:11:09
ESTOU CONSTRUINDO OUTRA CASA! Vem conferir as obras da família,SHEILA BELLAVER CAMINHONEIRA,262375,7160,22,People & Blogs,2023-04-20 12:11:10
"3 anos completos para criar um supercarro caseiro de 8,2 milhões",Henrique Carvalho,147002,11904,2,Autos & Vehicles,2023-04-20 12:11:10
Mochi Mochi | Katakuri (One Piece) | Enygma,Enygma,603277,57523,10,Music,2023-04-20 12:11:10
O Que Aconteceu no ACIDENTE com os MAMONAS? [Remake] EP. 1113,Aviões e Músicas,358832,46263,24,Entertainment,2023-04-20 12:11:10
GRÊMIO 1 X 0 SANTOS | MELHORES MOMENTOS | 1ª RODADA BRASILEIRÃO 2023 | ge.globo,ge,540584,16624,17,Sports,2023-04-20 12:11:10
"""EU FALO! O Flamengo FEZ 3 no Coritiba, e PODE TER CERTEZA que o Sampaoli..."" Vampeta É SINCERO!",Jovem Pan Esportes,608750,23385,17,Sports,2023-04-20 12:11:10
5 PESSOAS SOBREVIVENDO EM UMA ILHA COM 1 CASA,Lopers ,472661,16060,22,People & Blogs,2023-04-20 12:11:10
LOUD x paiN Gaming | CBLOL 2023: 1ª Etapa - Grande Final - Md5,CBLOL,910231,35029,20,Gaming,2023-04-20 12:11:10
LBFF 2023 RODADA 01 - GRUPOS A E B | FREE FIRE ESPORTS BRASIL,Free Fire Esports Brasil #LBFF,702387,49453,20,Gaming,2023-04-20 12:11:11
A Cada Segundo Eu Fico Mais FORTE!,Problems,1058521,33602,20,Gaming,2023-04-20 12:11:11
Trolei INIMIGO na BATALHA DE CONSTRUÇÃO do MINECRAFT,Athos,1032944,23764,20,Gaming,2023-04-20 12:11:11
Nossa Casa no sitio nos retoques finais  16/04/2023, Aqui É Nordeste ,212324,4494,22,People & Blogs,2023-04-20 12:11:11
DESÇO NO CHÃO - Millena & Manu Maia  (Clipe oficial),Millena e Manu Maia,459509,34386,10,Music,2023-04-20 12:11:11
"FLAMENGO vence observado por SAMPAOLI, FLU empolga. SANTOS e SÃO PAULO já preocupam? | Posse de Bola",UOL Esporte,87503,8525,17,Sports,2023-04-20 12:11:11
FRANQUIAS NOSTÁLGICAS ESTÃO VOLTANDO COM TUDO,CORTES - Leon e Nilce [Oficial],80211,9326,24,Entertainment,2023-04-20 12:11:11
Plantão do Brasieirão 2023 - Rodada 01 #futebol,Reclamação do Dia,57172,14873,23,Comedy,2023-04-20 12:11:11
Gusttavo Lima - DESEJO IMORTAL (Ao vivo no Mineirão),Gusttavo Lima Oficial,8393189,100827,10,Music,2023-04-20 12:11:12
Estamos grávidos! | Nosso presente de Deus chegou 💕😇,Casinha da Sabrina,265226,45408,22,People & Blogs,2023-04-20 12:11:12
MARIO JORGE FALA SOBRE CONVERSA COM SAMPAOLI! ABRE O CORAÇÃO SOBRE RETORNO DE BRUNO HENRIQUE! PEDRO,Redação Ninho,222318,10068,17,Sports,2023-04-20 12:11:12
GOTA D'ÁGUA (Filme completo),whinderssonnunes,1304227,176705,23,Comedy,2023-04-20 12:11:12
ESSES A GENTE NUNCA TINHA PROVADO | EXPERIMENTANDO - Ep.1642,Cadê a chave?,300289,42630,24,Entertainment,2023-04-20 12:11:12
O QUE VOCÊ NÃO VIU 2,Wiris Viana,532137,12363,23,Comedy,2023-04-20 12:11:12
COMO SEQUEI TODA A ÁGUA DO SERVIDOR! STONKSCRAFT #29,Brunim Neet's,160759,18988,20,Gaming,2023-04-20 12:11:12
"6ix9ine - WAPAE feat. feat. Angel Dior, Lenier, & Bulin 47 (Official Music Video)",Tekashi 6ix9ine,6849095,541863,10,Music,2023-04-20 12:11:12
Pressão pela volta de Jesus adiou escolha por Sampaoli. Entenda por que o Fla desistiu do português,Mauro Cezar,217242,22449,17,Sports,2023-04-20 12:11:12
"Raffé ft. Oruam e Mc Poze do Rodo - Desde Menorzin (prod. Mello, Honaiser)",Mainstreet Records,1159736,67577,10,Music,2023-04-20 12:11:12
SAMPAOLI TOMA PRIMEIRA DECISÃO COMO TREINADOR DO FLAMENGO! SAIBA TUDO SOBRE O ARGENTINO!,RaFla Mello,166621,20286,17,Sports,2023-04-20 12:11:12
COLETIVA BARBIERI | VASCOTV,VascoTV,113135,10094,17,Sports,2023-04-20 12:11:13
Mostrando Nosso Ape Novo - Tour pelo Nosso Ape,Debyianreceitas,45322,0,26,Howto & Style,2023-04-20 12:11:13
SIGNOS - PREVISÕES DA SEMANA  -16 a 22 ABRIL  2023 | André Mantovanni,André Mantovanni,88351,0,22,People & Blogs,2023-04-20 12:11:13
COMPRAMOS uma CASA! 🥰🏠 - Passpartout 2 🎨 #4,TazerCraft,170898,11545,20,Gaming,2023-04-20 12:11:13
Fazendinha Sessions #3 - Som do Interior,Fazendinha Sessions,3174869,117548,10,Music,2023-04-20 12:11:13
"BANDO - Derxan, Big Bllakk, Filipe Ret, L7NNON, Tz da Coronel, MC Ryan SP (Videoclipe Oficial)",PineappleStormTV,606558,43469,10,Music,2023-04-20 12:11:13
TE SUPEREI - Allana Macedo & @solangealmeida  (DVD Ao Vivo em Planaltina-DF),Allana Macedo,1841514,45168,10,Music,2023-04-20 12:11:13
Ice Spice & Nicki Minaj - Princess Diana (Official Music Video),IceSpiceVEVO,17445648,753607,10,Music,2023-04-20 12:11:13
Fernandinho | Único (Álbum Único - Live),Fernandinho Ministério Faz Chover,397575,23382,24,Entertainment,2023-04-20 12:11:13
blink-182 - I Miss You - Live at Coachella 2023,Coachella,1829388,34280,10,Music,2023-04-20 12:11:13
blink-182 - What's My Age Again - Live at Coachella 2023,Coachella,1053103,20606,10,Music,2023-04-20 12:11:13
TROLEI minha AMIGA CONTROLANDO TUDO que ela FAZ no MINECRAFT!,Marcelodrv,537592,16806,20,Gaming,2023-04-20 12:11:13
"Maurício e Eduardo, Max e Luan - Porta Mágoas (No 12) - (Clipe Oficial)",Maurício & Eduardo,243374,346,10,Music,2023-04-20 12:11:14
É PROIBIDO SE MEXER! 🐍🕷️ (ft. YOUTUBERS DAS ANTIGAS),Canal Canalha,1426941,230544,23,Comedy,2023-04-20 12:11:14
Fernanda Brum - Yeshua (Ao Vivo),FernandaBrumVEVO,302839,9759,10,Music,2023-04-20 12:11:14
LilWhind feat Arthurzim - Mídia  (Lyric Vídeo),Lil Whind,124528,12954,10,Music,2023-04-20 12:11:14
Dilsinho - O Choro é Livre (Ao Vivo),DilsinhoVEVO,896745,3607,10,Music,2023-04-20 12:11:14
"V2-05 | A Culpa é Sua - Ao Vivo - Daniel, Rick & Renner | DVD Daniel 40 Anos",Daniel Oficial,1226332,17487,10,Music,2023-04-20 12:11:14
David Kushner - Daylight (Official Music Video),DavidKushnerVEVO,3683371,292112,10,Music,2023-04-20 12:11:14
Mc Daniel x Nog - * da Anitta (Prod. Paiva) - Lyons Produções,Lyons Produções,4973872,232432,10,Music,2023-04-20 12:11:14
"V2-03 | O Cheiro Dela - Ao Vivo - Daniel,  Guilherme & Santiago | DVD Daniel 40 Anos",Daniel Oficial,786891,14660,10,Music,2023-04-20 12:11:14
SZA - Kill Bill Feat. Doja Cat (Remix),Doja Cat,1253738,97159,10,Music,2023-04-20 12:11:14
Post Malone - Chemical (Official Music Video),PostMaloneVEVO,5090262,206547,10,Music,2023-04-20 12:11:14
"V2-02 | Fogo de Amor - Ao Vivo - Daniel, César Menotti & Fabiano | DVD Daniel 40 Anos",Daniel Oficial,770558,13409,10,Music,2023-04-20 12:11:15
PROVANDO FRUTAS DIFERENTES!,Felipe Neto,1317535,122556,24,Entertainment,2023-04-20 12:11:15
AO VIVO | Coletiva pós jogo com Luís Castro | Botafogo x São Paulo,Botafogo TV,40508,4494,17,Sports,2023-04-20 12:11:15
O Último Jogo Vivo VENCE! (Modo DOMINAÇÃO),Problems,1338109,35290,20,Gaming,2023-04-20 12:11:15
Toque Dez -  Quem disse (Clipe Oficial),Toque Dez Oficial,637732,18639,10,Music,2023-04-20 12:11:15
MINHA IRMÃ TÁ GRÁVIDA 😭 MINHA REAÇÃO 😱,Laura Brito,90240,9392,26,Howto & Style,2023-04-20 12:11:15
TIRAMOS A PORTA DO QT |  TROCAMOS AS COISAS DA ÁREA | HORA DE COMEÇAR A DECORAÇÃO | TUDO DIFERENTE,Vivi Magalhães,101166,10308,24,Entertainment,2023-04-20 12:11:15
Lagum - Depois do Fim #faixa2 (Visualizer),LagumVEVO,86593,4856,10,Music,2023-04-20 12:11:15
Bondinho do Pão de Açucar - Férias no Brasil - Família Maria Clara e JP,Família Maria Clara e JP,306769,3786,22,People & Blogs,2023-04-20 12:11:15
Metallica: Sleepwalk My Life Away (Official Music Video),Metallica,1167428,48839,10,Music,2023-04-20 12:11:15
A dieta de Ketley,Talokudo,419456,11783,27,Education,2023-04-20 12:11:16
PRIMEIRO ROLÊ NO BRAVA 23 ANOS PARADO! + PARABRISA TEM SALVAÇÃO?!?!,Project Car Brasil,266410,31735,2,Autos & Vehicles,2023-04-20 12:11:16
The Legend of Zelda: Tears of the Kingdom – Official Trailer #3,Nintendo of America,7989199,394169,20,Gaming,2023-04-20 12:11:16
COMO FUGI DA PRISÃO E FIZ VINGANÇA 😈 STONKSCRAFT #27,Brunim Neet's,186990,21222,20,Gaming,2023-04-20 12:11:16
Gustavo Mioto - Vida Após Você (Ao Vivo Em Recife / 2022),GustavoMiotoVEVO,192132,6192,10,Music,2023-04-20 12:11:16
TUDO É TEU / NOVA CRIATURA / REDE AO MAR (CLIPE OFICIAL) | MORADA,MORADA,217690,18365,10,Music,2023-04-20 12:11:16
PAULINHO O LOKO VS LUQUET4 NO PRIMEIRO DESAFIO DE TREINO COM FELIPE FRANCO,Felipe Franco,273685,29630,17,Sports,2023-04-20 12:11:16
SKATES DE DEDO DA HOT WHEELS - Família Brancoala,Brancoala,1183893,17510,24,Entertainment,2023-04-20 12:11:16
Kill Bill,SZA - Topic,1018042,67328,10,Music,2023-04-20 12:11:16
A MAIOR LOJA do SERVIDOR!!! - StonksCraft 2 #15,Forever Player,265145,33693,20,Gaming,2023-04-20 12:11:16
NabNab e Slow Seline (Garten of Banban) Vs. Mussoumano - Batalha com Games,Mussoumano,934544,30033,10,Music,2023-04-20 12:11:17
"ROSALÍA, Rauw Alejandro - VAMPIROS (Official Video)",RosaliaVEVO,3501826,140597,10,Music,2023-04-20 12:11:17
"Achei muita coisa boa na mesma casa da semana passada, essa vizinhança é a melhor 😁",Adeline Camargo,200035,26662,22,People & Blogs,2023-04-20 12:11:17
Presidente Lula durante visita oficial à China,Lula,135074,8809,25,News & Politics,2023-04-20 12:11:17
Lagum - De Amor Eu Não Morri #faixa3 (Visualizer),LagumVEVO,55786,3996,10,Music,2023-04-20 12:11:17
EXPLICANDO MINHA “NOVA VOZ” PARA VOCÊS!,Vanessa Lopes,139301,6688,22,People & Blogs,2023-04-20 12:11:17
Princess Diana,Ice Spice - Topic,1056529,59677,10,Music,2023-04-20 12:11:17
Final Fantasy XVI - State of Play 4K | PS5 Games,PlayStation,1231909,40282,20,Gaming,2023-04-20 12:11:17
"Zoeira Jogo Aberto: Com direito a remo, Ronaldo Giovaneli sofre com derrota do Corinthians",Jogo Aberto,341594,11680,17,Sports,2023-04-20 12:11:17
EU CONSTRUÍ UM PLANETA INTEIRO NO SERVIDOR DA CREATIVE SQUAD,MucaHD,399686,16141,20,Gaming,2023-04-20 12:11:17
VEIGH - Vida Chique & Perdoa Por Tudo Vida (Clipe Oficial),VEIGH,2720157,173021,10,Music,2023-04-20 12:11:17
JJ ABRE JOGO E PRESIDENTE PODE DEMITIR! REFORMULAÇÃO JÁ! BRAZ Ñ SERVE PRA COBRAR E LANDIM TEM QUE…,Paparazzo Rubro-Negro,119615,11636,17,Sports,2023-04-20 12:11:18
COMPRAS PRA CASA NOVA!,Christian Figueiredo,73325,6575,22,People & Blogs,2023-04-20 12:11:18
EU DESTRUÍ O THE END NA PICARETA - StonksCraft 2,Apuh,315681,43203,20,Gaming,2023-04-20 12:11:18
FOMOS DO MINECRAFT PARA A VIDA REAL com LOPERS e ANINHA,Daviajando,656804,18051,20,Gaming,2023-04-20 12:11:18
🔴 FLAMENGO espera Jorge Jesus após VEXAME EM MARINGÁ? CORINTHIANS e SÃO PAULO preocupam?,UOL Esporte,92325,8726,17,Sports,2023-04-20 12:11:18
Atrapalhei Meu Amigo Bobão com Criaturas no Minecraft,Athos,652787,16700,20,Gaming,2023-04-20 12:11:18
Ele quer as Frutas mais Caras e Raras do Blox Fruits em troca de uma Conta,Canal Clash War,346265,35110,20,Gaming,2023-04-20 12:11:18
SENÃO FICA CHATO,Porta dos Fundos,929904,75562,24,Entertainment,2023-04-20 12:11:18
POBRE fazendo DIETA - Parte 2,Glauber Cunha,196117,12224,23,Comedy,2023-04-20 12:11:18
SERÁ QUE O BRAVA 23 ANOS PARADO VAI FUNCIONAR?!?!,Project Car Brasil,348886,39490,2,Autos & Vehicles,2023-04-20 12:11:18
MINHA NOVA CASA NOVA TEM CORES E UMA SUPRESA PRA VOCÊS | EP. 2,Maurício Arruda,132280,15856,26,Howto & Style,2023-04-20 12:11:18
COMPREI outro PS5 na CHINA por R$250 (FUNCIONOU?),Fiaspo,305994,14621,22,People & Blogs,2023-04-20 12:11:18
Harry Potter Max Original Series | Official Announcement | Max,HBO Max,1619458,41684,1,Film & Animation,2023-04-20 12:11:19
[BE ORIGINAL] IVE(아이브) 'I AM' (4K),STUDIO CHOOM [스튜디오 춤],7776053,346849,24,Entertainment,2023-04-20 12:11:19
ESTAMOS GRÁVIDOS - nosso bebê arco-íris - LAIS BRITO,Laís Brito,96583,11963,22,People & Blogs,2023-04-20 12:11:19
BR1GUEI COM A CAROL E SAIMOS NO T4PA!!!! 🤬,Dani Nobrega,458810,38191,22,People & Blogs,2023-04-20 12:11:19
The Penguin | In-Production Teaser | Max,HBO Max,2245365,76815,1,Film & Animation,2023-04-20 12:11:19
O LABORATÓRIO SECRETO,Mendrake,757822,28820,20,Gaming,2023-04-20 12:11:19
JORGE JESUS DIZ SIM AO FLAMENGO MAS IMPÕE CONDIÇÃO! PROPOSTA PESADA NA MESA DO MENGÃO! RELACIONADOS!,FLAZOEIRO,379703,47215,17,Sports,2023-04-20 12:11:19
FLUTV - BASTIDORES - FLUMINENSE 4 X 1 FLAMENGO - CAMPEÃO CARIOCA 2023,Fluminense Football Club,228342,22060,17,Sports,2023-04-20 12:11:19
A WANDINHA NOS OBRIGOU A FAZER COISAS HORRÍVEIS AS 3:00 HORAS DA MANHÃ !!,Lorrayne Oliveira,503044,15127,24,Entertainment,2023-04-20 12:11:19
O GABRIEL e a LAVINIA se reencontraram!!,Paty,455354,21198,24,Entertainment,2023-04-20 12:11:19
"BBB 23: ALINE, CEZAR OU AMANDA: QUEM VOCÊ QUER ELIMINAR NO PAREDÃO DE HOJE?",Chico Barney ,37574,4405,24,Entertainment,2023-04-20 12:11:19
OBRIGUEI O APUH A QUEBRAR O THE END INTEIRO - STONKSCRAFT 2,Dlet,109346,12416,20,Gaming,2023-04-20 12:11:19
"TCHAU, FERNANDO LÁZARO! CRAQUE NETO DETONA DERROTA DO CORINTHIANS PARA O REMO",Craque Neto 10,83901,3767,17,Sports,2023-04-20 12:11:20
SOBREVIVA A PRISÃO LARANJA POR UM DIA !,MALOUCOS,322758,6718,24,Entertainment,2023-04-20 12:11:20
Menor Celular do Mundo,Geleia TV,469427,23288,24,Entertainment,2023-04-20 12:11:20
ELES QUEREM ME BANIR DA SÉRIE... - StonksCraft 2,Apuh,255635,25340,20,Gaming,2023-04-20 12:11:20
A CADA WI-FI O MINECRAFT FICA MAIS REALISTA,Gui,301658,5189,20,Gaming,2023-04-20 12:11:20
QUARTO DE HÓSPEDES PRONTO PRA RECEBER A VOVÓ SPA DAY DO CASAL TEM COISAS QUE NÃO VAMOS ACEITAR !,SEGREDOS DA MA,186317,0,22,People & Blogs,2023-04-20 12:11:20
Saiba qual a única boa solução para o Flamengo esperar Jorge Jesus e tentar ser competitivo até lá,Mauro Cezar,58133,6384,17,Sports,2023-04-20 12:11:20
